sourceUrl,name,title,payoff,shortDescription,pros,cons,alternatives,tags,apiUsed,department,function,freeTier,openSource,releasedYear,websiteUrl,documentationUrl,githubUrl,twitterUrl,screenshot,screenshot_640,screenshot_400,updatedAt
"https://htmlrev.com/","HTMLrev","htmlrev.com","Free HTML templates for all","HTMLrev offers a vast collection of over 1500 free HTML website templates suitable for various needs such as blogs, ecommerce sites, and admin dashboards. It caters to developers and designers looking for quick and customizable web solutions. An example use case is a startup needing a landing page without the overhead of designing from scratch.","Wide variety of templates|No cost to use|Templates for multiple frameworks","Limited customization in free versions|No dedicated support|May not be unique designs","BootstrapMade [bootstrapmade.com]|ThemeWagon [themewagon.com]|Colorlib [colorlib.com]","web templates|HTML|free resources|web design","false","Development","Site Builder","true","true","2018","https://htmlrev.com/",,"https://github.com/tailwindtoolbox/Landing-Page","https://x.com/webdevluc","/screenshots/htmlrev_com.png","/screenshots/htmlrev_com_640.png","/screenshots/htmlrev_com_400.png","2025-05-08T08:33:16.367Z"
"https://huly.io/","Huly","huly.io","All-in-one team productivity app","Huly is an open-source platform designed to enhance team productivity by integrating the functionalities of tools like Linear, Jira, Slack, and Notion. It is tailored for developers and product teams, facilitating seamless collaboration and efficient management of projects and tasks. An example use case is a software development team using Huly to manage projects, track time, and synchronize work with GitHub, all within a unified workspace.","Integrates multiple tools into one platform|Open-source with flexible customization|Real-time collaboration and communication","Potential complexity with many integrated features|Dependence on community for updates and support|May require initial training for full utilization","Notion [notion.so]|Slack [slack.com]|Jira [atlassian.com/software/jira]","project management|collaboration|open source|productivity","true","Development","Project Tools","true","true","2021","https://huly.io/","https://huly.io/docs","https://github.com/hcengineering/platform","https://x.com/huly_io","/screenshots/huly_io.png","/screenshots/huly_io_640.png","/screenshots/huly_io_400.png","2025-05-09T03:16:09.178Z"
"https://it-tools.tech/","IT Tools","it-tools.tech","Essential tools for developers","IT Tools offers a variety of online utilities designed specifically for developers. These tools help in formatting, analyzing, and generating code. Ideal for software engineers and web developers, the platform can, for example, be used to quickly format JSON data or encode URLs. This makes it a handy companion in day-to-day coding tasks.","User-friendly interface|Wide range of tools|No sign-up required","Limited advanced features|No user accounts|Minimal support options","Postman [postman.com]|Jupyter [jupyter.org]|CodePen [codepen.io]","development tools|online utilities|coding|software development","false","Development","Development Tools","true","true","2018","https://it-tools.tech/","https://it-tools.tech/docs","https://github.com/CorentinTh/it-tools/tree/v2024.10.22-7ca5933","https://x.com/ittoolsdottech","/screenshots/it_tools_tech.png","/screenshots/it_tools_tech_640.png","/screenshots/it_tools_tech_400.png","2025-05-08T09:27:08.922Z"
"https://jigsawstack.com/","JigsawStack","jigsawstack.com","AI infra for your tech stack","JigsawStack provides AI infrastructure solutions tailored for technology stacks. It offers custom small models with high accuracy and scalable infrastructure, ideal for developers and AI engineers. An example use case is integrating AI capabilities like speech to text or web scraping into existing platforms quickly, enhancing productivity and functionality.","Highly specialized AI models|Rapid integration capabilities|Supports a wide range of AI services","Still in beta, may have bugs|Limited information on pricing|Alpha features may be unstable","OpenAI [openai.com]|Hugging Face [huggingface.co]|IBM Watson [ibm.com/watson]","AI|web scraping|speech to text|infrastructure","true","Information Technology","AI & ML","true","true","2021","https://jigsawstack.com/","https://jigsawstack.com/docs","https://github.com/JigsawStack","https://x.com/jigsawstack","/screenshots/jigsawstack_com.png","/screenshots/jigsawstack_com_640.png","/screenshots/jigsawstack_com_400.png","2025-05-09T10:24:57.583Z"
"https://jsoncrack.com/","JSON Crack","jsoncrack.com","Visualize JSON as interactive graphs","JSON Crack is an open-source online tool designed to help users visualize and understand complex JSON data through interactive graphs. Users can upload JSON files, input data via URL, or type directly into a text editor. The tool automatically converts data into a visual tree graph, allowing for quick comprehension and easy exploration. It supports multiple formats like YAML, CSV, XML, and TOML, catering to developers, data scientists, and anyone dealing with data. Example use case: A developer can convert JSON to CSV for easier data manipulation and sharing.","Supports multiple data formats|Real-time data visualization|No data stored on servers","Limited to web-based interface|No mention of collaboration features|Dependent on browser performance","CyberChef [gchq.github.io]|Quicktype [quicktype.io]|Altair GraphQL Client [altair.sirmuel.design]","data visualization|open source|JSON editing|data conversion","false","Data & Analytics","Visual Builder","true","true","2023","https://jsoncrack.com/",,"https://github.com/AykutSarac/jsoncrack.com","https://x.com/jsoncrack","/screenshots/jsoncrack_com.png","/screenshots/jsoncrack_com_640.png","/screenshots/jsoncrack_com_400.png","2025-05-09T03:15:09.172Z"
"https://julius.ai/","Julius AI","julius.ai","Expert AI-driven data analysis","Julius AI combines the functionalities of Excel, Python, and ChatGPT into a single, powerful tool designed to provide expert-level data analysis. Users can upload files to generate graphs, clean, merge, and sort data, and ask complex questions to gain deep insights. Ideal for knowledge workers in various industries, it simplifies data handling and enhances decision-making processes.","Integrates Excel, Python, and ChatGPT|Generates graphs and charts automatically|Offers a free starting tier","May require data privacy considerations|Limited to English language support|Potentially complex for beginners","Tableau [tableau.com]|Microsoft Power BI [powerbi.com]|Google Data Studio [datastudio.google.com]","AI|data analysis|visualization|SaaS","false","Data & Analytics","Analytics","true","true","2025","https://julius.ai/",,"https://github.com/caesarHQ","https://x.com/JuliusAI_","/screenshots/julius_ai.png","/screenshots/julius_ai_640.png","/screenshots/julius_ai_400.png","2025-05-09T09:55:51.181Z"
"https://justbuildthings.com/","just build things","justbuildthings.com","Free AI & creative tools","just build things offers a suite of AI and creative tools designed to assist in various digital tasks. From generating AI-based text and images to creating music and analyzing data, this platform serves a wide range of users including marketers, developers, and designers. Example use case: A marketer uses the tool to automatically generate blog posts and marketing content, saving time and enhancing productivity.","Wide range of tools|User-friendly interfaces|Free access to most features","Limited customization options|May lack advanced features for professionals|Dependent on internet connectivity","Canva [canva.com]|Adobe Express [adobe.com/express]|Descript [descript.com]","AI tools|creative tools|productivity|design","false","Creative","Design Tools","true","false","2021","https://justbuildthings.com/",,"https://github.com/search?q=just%20build%20things&type=repositories",,"/screenshots/justbuildthings_com.png","/screenshots/justbuildthings_com_640.png","/screenshots/justbuildthings_com_400.png","2025-05-09T09:55:33.009Z"
"https://langbase.com/","Langbase","langbase.com","Build powerful AI products easily","Langbase is a serverless AI developer platform designed to help product companies and developers create powerful AI agents effortlessly. It offers an exceptional developer experience, allowing users to build, deploy, and scale AI agents with memory. An example use case is the creation of an AI chatbot that can handle complex customer interactions without extensive coding.","Serverless architecture simplifies operations|Supports over 250 LLMs with a standard API|Highly developer-friendly and collaborative","May require initial learning curve|Potentially higher costs at scale|Limited to AI and serverless applications","AWS Lambda [aws.amazon.com/lambda]|Google Cloud Functions [cloud.google.com/functions]|Azure Functions [azure.microsoft.com/en-us/services/functions]","AI|serverless|developer tools|scalability","true","Research & Development","AI & ML","true","true","2021","https://langbase.com/","https://langbase.com/docs","https://github.com/LangbaseInc/","https://x.com/langbaseinc","/screenshots/langbase_com.png","/screenshots/langbase_com_640.png","/screenshots/langbase_com_400.png","2025-05-08T08:28:13.517Z"
"https://liftos.app","liftOS","liftos.app","Optimize your business operations","liftOS is a comprehensive tool designed to streamline business operations across various departments. It offers solutions for automating workflows, managing resources, and enhancing productivity. For instance, a small business could use liftOS to automate their inventory management, reducing manual errors and saving time.","Enhances operational efficiency|Automates repetitive tasks|User-friendly interface","May be complex for beginners|Potentially high subscription cost|Limited customizability","Monday.com [monday.com]|Asana [asana.com]|Trello [trello.com]","business operations|workflow automation|productivity","true","Operations","Automation","true","false","2018","https://liftos.app","https://liftos.app/docs","https://github.com/search?q=liftos&type=repositories",,"/screenshots/liftos_app.png","/screenshots/liftos_app_640.png","/screenshots/liftos_app_400.png","2025-05-07T11:49:27.287Z"
"https://liftos.io","liftOS","liftos.io","Collaborative home for your team","liftOS is designed to enhance workplace efficiency by integrating AI into daily operations. It serves businesses, agencies, and freelancers by providing a unified platform for task management, document handling, and collaboration. An example use case is a small business owner who utilizes liftOS to reduce the time spent switching between applications, thus saving up to 12 hours weekly.","Saves significant time by reducing app switching|Integrates AI for enhanced productivity|Supports collaboration across data and tools","May have a learning curve for new users|Dependent on continuous internet connectivity|Potential privacy concerns with AI handling data","Notion [notion.so]|Asana [asana.com]|Monday.com [monday.com]","AI|productivity|collaboration|task management","false","Operations","Project Tools","true","false","2020","https://liftos.io",,"https://github.com/search?q=liftos&type=repositories",,"/screenshots/liftos_io.png","/screenshots/liftos_io_640.png","/screenshots/liftos_io_400.png","2025-05-08T09:06:31.878Z"
"https://lobehub.com/","LobeChat","lobehub.com","Surpassing ChatGPT with smarter features","LobeChat is a personal LLM productivity tool designed to enhance user experience beyond traditional models like ChatGPT. It allows users to build personalized AI assistants for various tasks such as creative ventures, writing, and career tasks. Users can command AI squads to tackle specific challenges, enhancing work efficiency. Ideal for professionals seeking to boost productivity and creativity on the go.","Customizable AI assistants|Supports multiple devices and modalities|Community and developer engagement","May require technical knowledge for customization|Potential privacy concerns with data handling|Dependent on continuous updates for new features","OpenAI ChatGPT [openai.com]|Microsoft Azure AI [azure.microsoft.com]|Google AI [ai.google]","AI|productivity|personal assistant|customization","true","Research & Development","AI & ML","true","true","2023","https://lobehub.com/","https://lobehub.com/documentation","https://github.com/lobehub/lobe-chat","https://x.com/lobehub","/screenshots/lobehub_com.png","/screenshots/lobehub_com_640.png","/screenshots/lobehub_com_400.png","2025-05-09T02:00:09.017Z"
"https://midship.ai/","Midship","midship.ai","AI-driven audit efficiency","Midship streamlines the audit process using AI to automatically sort, categorize, and test audit samples. Designed for auditors, it transforms documents into structured work papers and links test results to evidence for easy review. An example use case is during busy audit seasons, where Midship significantly reduces manual workload by automating sample testing and documentation.","Automates document sorting and categorization|Links test results to supporting evidence|Integrates with Excel for enhanced functionality","Dependence on digital document formats|Potential privacy and security concerns|May not handle very unique or complex audit scenarios","AuditBoard [auditboard.com]|TeamMate+ [teammatesolutions.com]|CaseWare [caseware.com]","AI|audit|compliance|automation","false","Finance & Accounting","Documents","false","false","2021","https://midship.ai/",,"https://github.com/search?q=midship&type=repositories","https://x.com/ycombinator/status/1821924399286763521","/screenshots/midship_ai.png","/screenshots/midship_ai_640.png","/screenshots/midship_ai_400.png","2025-05-09T02:00:24.498Z"
"https://mindpal.space/","MindPal","mindpal.space","Build Your AI Workforce","MindPal enables businesses to automate complex processes using AI agents and multi-agent workflows. It is designed for businesses looking to enhance productivity by automating tasks such as email marketing, business analysis, and content generation. An example use case is automating daily AI news reports generation.","Customizable AI agents|Integration with multiple AI models|One-click public publishing of workflows","Potential complexity in setup|Dependence on external AI models|Possible data privacy concerns","Zapier [zapier.com]|Make [make.com]|Integromat [integromat.com]","AI|automation|workflow management|productivity","true","Operations","Automation","true","false","2021","https://mindpal.space/","https://mindpal.space/documentation","https://github.com/search?q=mindpal&type=repositories",,"/screenshots/mindpal_space.png","/screenshots/mindpal_space_640.png","/screenshots/mindpal_space_400.png","2025-05-09T10:29:47.418Z"
"https://omni.co/","Omni Analytics","omni.co","Explore data with speed and accuracy","Omni Analytics revolutionizes business intelligence by enabling teams to explore data through various interfaces such as SQL, AI, or a point-and-click UI. It's designed for data teams looking to transition from simple request handlers to strategic partners. An example use case is product teams using Omni to quickly build and scale customer-facing data products, significantly reducing development time from months to weeks.","Supports multiple data exploration interfaces|Robust integration with modern data platforms like Snowflake and dbt|Enterprise-grade security features","May require initial training for non-technical users|Potential high cost for small businesses|Dependence on third-party platforms for full functionality","Tableau [tableau.com]|Looker [looker.com]|Power BI [powerbi.microsoft.com]","business intelligence|data analytics|embedded analytics|data integration","true","Data & Analytics","Analytics","false","false","2018","https://omni.co/","https://omni.co/documentation","https://github.com/search?q=omni%20analytics&type=repositories","https://twitter.com/Omni","/screenshots/omni_co.png","/screenshots/omni_co_640.png","/screenshots/omni_co_400.png","2025-05-09T10:28:57.330Z"
"https://outerbase.com/developers/outerbase-studio/","Outerbase Studio","outerbase.com","Powerful open-source database GUI","Outerbase Studio is a versatile database GUI client supporting multiple database systems like SQLite, MySQL, and Postgres. It allows users to manage databases directly from a desktop app or via command line. Ideal for developers and database administrators, the tool simplifies data manipulation, query organization, and schema editing. Users can benefit from features like a powerful data editor, query notebooks, and structured query saving, making it suitable for both small projects and enterprise-level operations.","Supports multiple database types|Open-source and customizable|Advanced query and schema editing features","Limited to database management|May require technical knowledge to use effectively|Desktop app might not be suitable for all users","DBeaver [dbeaver.io]|HeidiSQL [heidisql.com]|TablePlus [tableplus.com]","database management|open source|data editing|SQL","false","Data & Analytics","Databases","false","true","2025","https://outerbase.com/developers/outerbase-studio/","https://docs.outerbase.com/","https://github.com/outerbase/studio","https://x.com/outerbase","/screenshots/outerbase_com.png","/screenshots/outerbase_com_640.png","/screenshots/outerbase_com_400.png","2025-05-09T10:28:04.690Z"
"https://paint-potion.com/","Paint Potion","paint-potion.com","Create style-consistent illustrations","Paint Potion is an AI-powered tool designed for illustrators and designers to create vector illustrations that match their unique style. Users can upload reference images to teach the AI their style, type a prompt, and instantly receive four style-consistent illustrations. This tool is ideal for marketing professionals and content creators who need quick, on-brand visuals for digital and print campaigns.","Instant generation of style-consistent illustrations|Supports both SVG and PNG formats|Simple and transparent pricing model","Limited to vector illustrations|No free tier available|Requires multiple reference images for best results","Adobe Illustrator [adobe.com]|CorelDRAW [coreldraw.com]|Inkscape [inkscape.org]","AI|design tools|vector illustrations|digital marketing","false","Creative","Design Tools","false","false","2021","https://paint-potion.com/",,"https://github.com/search?q=paint%20potion&type=repositories",,"/screenshots/paint_potion_com.png","/screenshots/paint_potion_com_640.png","/screenshots/paint_potion_com_400.png","2025-05-08T09:27:57.980Z"
"https://paradedb.com/","ParadeDB","paradedb.com","Zero ETL search and analytics for Postgres","ParadeDB transforms Postgres into a powerful search and analytics engine, eliminating the need for Elasticsearch. It is designed for real-time, update-heavy workloads, making it ideal for businesses that require efficient data handling without complex ETL processes. Users can enhance Postgres' search capabilities and integrate with existing infrastructure seamlessly. Example use case includes companies needing to perform fast data analytics on large-scale Postgres databases.","Enhanced search capabilities with BM25 scoring|Seamless integration with existing infrastructures|Support for fast analytics and faceting","Limited to Postgres databases|May not support all Elasticsearch features|Dependent on the underlying performance of Postgres","Elasticsearch [elastic.co]|Solr [lucene.apache.org/solr]|Algolia [algolia.com]","data analytics|database|search engine|Postgres","true","Data & Analytics","Search","false","true","2025","https://paradedb.com/","https://paradedb.com/documentation","https://github.com/paradedb/paradedb","https://x.com/paradedb","/screenshots/paradedb_com.png","/screenshots/paradedb_com_640.png","/screenshots/paradedb_com_400.png","2025-05-08T13:34:11.724Z"
"https://pietrastudio.com/","Pietra","pietrastudio.com","Run your brand profitably","Pietra offers a comprehensive platform for entrepreneurs and brands to streamline their operations. It connects users with top factories, provides storage and fulfillment solutions, and offers software to enhance growth across various channels. An example use case is a wellness brand using Pietra to reduce costs and launch new products efficiently.","Access to 1300+ vetted factories|Pre-negotiated shipping & freight rates|Software to grow on every channel","Limited to members only|No clear pricing information available|May not suit very small startups","Shopify [shopify.com]|BigCommerce [bigcommerce.com]|Magento [magento.com]","E-commerce|Supply Chain Management|Brand Development","false","Operations","E-commerce","false","false","2018","https://pietrastudio.com/","https://help.pietrastudio.com/","https://github.com/search?q=pietra&type=repositories","https://twitter.com/shoppietra","/screenshots/pietrastudio_com.png","/screenshots/pietrastudio_com_640.png","/screenshots/pietrastudio_com_400.png","2025-05-09T09:56:53.722Z"
"https://plausible.io","Plausible Analytics","plausible.io","Privacy-friendly analytics alternative","Plausible Analytics offers a simple, lightweight, and privacy-focused alternative to Google Analytics. It is designed for startups, agencies, and creators who need straightforward insights without complex setups. Users can easily import data from Google Analytics, view essential metrics on a single dashboard, and manage multiple sites without the need for cookie consents or GDPR banners.","Lightweight and fast script|No need for cookie/GDPR consent|Open source and customizable","Lesser known than Google Analytics|May lack some advanced features|Limited third-party integrations","Google Analytics [analytics.google.com]|Matomo [matomo.org]|Cloudflare Analytics [cloudflare.com]","web analytics|privacy|open source|GDPR compliant","true","Marketing","Site Analytics","true","true","2019","https://plausible.io","https://plausible.io/docs","https://github.com/plausible/analytics","https://twitter.com/PlausibleHQ","/screenshots/plausible_io.png","/screenshots/plausible_io_640.png","/screenshots/plausible_io_400.png","2025-05-08T09:06:23.147Z"
"https://poe.com/","Poe","poe.com","Fast, Helpful AI Chat","Poe is an AI chat platform that integrates various AI models like GPT-4.5 and Claude 3.7 Sonnet, providing users with a comprehensive tool for engaging with AI technologies. It's designed for businesses, developers, and researchers who require robust AI interactions. Example use case: a company using Poe to automate customer support through AI-driven chat.","Integrates multiple AI models|Designed for versatile applications|User-friendly privacy settings","Dependent on third-party AI technologies|Potential privacy concerns with AI interactions|Limited offline functionality","OpenAI ChatGPT [openai.com]|IBM Watson Assistant [ibm.com]|Rasa [rasa.com]","AI|chatbot|customer support|technology integration","true","Customer Service","Chat & Calls","true","false","2021","https://poe.com/","https://poe.com/docs","https://github.com/search?q=poe&type=repositories",,"/screenshots/poe_com.png","/screenshots/poe_com_640.png","/screenshots/poe_com_400.png","2025-05-08T08:27:05.867Z"
"https://quillow.co/","Quillow","quillow.co","Build a beautiful microsite easily","Quillow allows users to create engaging microsites with a variety of customizable blocks. It's designed for individuals and businesses wanting to enhance their online presence without complex coding. Users can integrate social media, manage content, and even connect a custom domain. Ideal for influencers, marketers, or small businesses looking to consolidate their digital footprint in a single, visually appealing microsite.","Customizable design options|Integrations with major social platforms|Mobile and desktop optimization","Limited to microsite functionalities|Potential branding removal costs|Dependent on third-party platform stability","Linktree [linktr.ee]|Bio.fm [bio.fm]|Carrd [carrd.co]","site builder|content management|marketing|design","false","Marketing","Site Builder","true","false","2024","https://quillow.co/",,"https://github.com/search?q=quillow&type=repositories",,"/screenshots/quillow_co.png","/screenshots/quillow_co_640.png","/screenshots/quillow_co_400.png","2025-05-08T10:27:51.998Z"
"https://reverseui.com/","Reverse UI","reverseui.com","Premium UI Components for Apps","Reverse UI specializes in providing high-quality animated UI components designed for modern web applications. It caters to developers and designers seeking to enhance user interfaces with engaging animations. An example use case could be a tech startup wanting to quickly implement sophisticated UI elements to improve user experience and engagement without extensive custom development.","High-quality animations|Easy integration|Enhances user engagement","Limited customization options|May increase page load times|Requires modern browser support","Framer [framer.com]|Material-UI [mui.com]|Ant Design [ant.design]","UI components|web development|animation|user experience","false","Design","Design Tools","true","false","2020","https://reverseui.com/",,"https://github.com/search?q=reverse%20ui&type=repositories","https://x.com/kukaarmedin","/screenshots/reverseui_com.png","/screenshots/reverseui_com_640.png","/screenshots/reverseui_com_400.png","2025-05-07T11:49:57.419Z"
