sourceUrl,name,title,payoff,shortDescription,pros,cons,alternatives,tags,apiUsed,department,function,freeTier,openSource,releasedYear,websiteUrl,documentationUrl,githubUrl,twitterUrl,screenshot,screenshot_640,screenshot_400,updatedAt
"https://activepieces.com","Activepieces","activepieces.com","AI-first, no-code automation software","Activepieces is a versatile automation platform designed for teams of all sizes, from startups to Fortune 50 companies. It offers a no-code, AI-first approach, allowing users to easily create powerful automations without writing code. Users can integrate with hundreds of apps, automate repetitive tasks, and enhance workflows. For example, a marketing team can automate data collection and analysis from various digital campaigns, streamlining their reporting and decision-making processes.","No-code automation builder|Open-source and customizable|Supports AI-driven automations","May require technical knowledge for advanced features|Limited support compared to paid products|Dependent on community contributions for new features","Zapier [zapier.com]|Integromat [integromat.com]|Automate.io [automate.io]","automation|AI|no-code|open-source","true","Operations","Automation","true","true","2021","https://activepieces.com","https://docs.activepieces.com","https://github.com/activepieces/activepieces",,"/screenshots/activepieces_com.png","/screenshots/activepieces_com_640.png","/screenshots/activepieces_com_400.png","2025-05-08T08:52:03.436Z"
"https://airflow.apache.org/","Apache Airflow","airflow.apache.org","Orchestrate workflows with ease","Apache Airflow is a powerful tool designed for scheduling and automating complex workflows. It allows users to define their pipelines in Python, offering flexibility and dynamic pipeline generation. This makes it ideal for data engineers and scientists who need to manage tasks ranging from data extraction to machine learning model training. Airflow's user-friendly web interface and extensive integration capabilities with major cloud services simplify monitoring and execution of workflows.","Flexible and dynamic pipeline generation|Extensive integration with major cloud platforms|User-friendly web interface for workflow management","Steep learning curve for new users|Primarily suited for users with Python knowledge|Can be resource-intensive for large-scale deployments","Luigi [luigi.readthedocs.io]|Prefect [prefect.io]|Dagster [dagster.io]","workflow automation|data engineering|open source|scalability","false","Data & Analytics","Automation","false","true","2015","https://airflow.apache.org/","https://airflow.apache.org/docs/","https://github.com/apache/airflow-site/edit/main/landing-pages/site/content/en/_index.html",,"/screenshots/airflow_apache_org.png","/screenshots/airflow_apache_org_640.png","/screenshots/airflow_apache_org_400.png","2025-05-09T03:15:09.172Z"
"https://aitable.ai/","AITable","aitable.ai","Automate data across 6,000+ apps","AITable.ai simplifies workflow automation by integrating with over 6,000 apps through platforms like Zapier and Make. It's designed for businesses seeking to enhance CRM and project management through AI-driven data organization and automation. Example use: A company can automate data entry and connect systems to streamline project management tasks.","Integrates with 6,000+ apps for extensive automation|Customizable AI-driven data organization tools|Visual database interface enhances user experience","Limited AI capabilities in some areas|May require initial setup time|Dependent on third-party integrations","Airtable [airtable.com]|Zapier [zapier.com]|Make [make.com]","automation|AI|data management|workflow","true","Operations","Automation","true","true","2021","https://aitable.ai/","https://aitable.ai/docs","https://github.com/apitable/apitable","https://twitter.com/aitable_ai","/screenshots/aitable_ai.png","/screenshots/aitable_ai_640.png","/screenshots/aitable_ai_400.png","2025-05-09T09:56:47.940Z"
"https://anyquery.dev","Anyquery","anyquery.dev","Use SQL for anything","Anyquery is a versatile CLI tool designed to run SQL queries across various data sources, including files, APIs, logs, and local apps. It supports multiple operating systems like GNU/Linux, macOS, and Windows, making it accessible for a wide range of users. Example use case: A developer can use Anyquery to integrate SQL querying capabilities into their project management software, enhancing data retrieval and analysis.","Supports multiple platforms (GNU/Linux, macOS, Windows)|Integrates with various data sources and services|Fast query execution times","CLI-based, which might not be user-friendly for all|Limited to SQL knowledge users|Potential complexity in setting up integrations","Metabase [metabase.com]|Airtable [airtable.com]|Retool [retool.com]","SQL|data integration|CLI tool|cross-platform","false","Data & Analytics","Databases","false","true","2022","https://anyquery.dev",,"https://github.com/julien040/anyquery","https://x.com/JulienC_me","/screenshots/anyquery_dev.png","/screenshots/anyquery_dev_640.png","/screenshots/anyquery_dev_400.png","2025-05-08T09:07:10.196Z"
"https://anythingllm.com/","AnythingLLM","anythingllm.com","AI application for everyone","AnythingLLM is a versatile AI desktop application designed for a wide range of users, from developers to business professionals. It allows users to interact with documents, leverage AI agents, and run various language models locally or connect to enterprise solutions like OpenAI and AWS. A typical use case might involve a user importing business documents to analyze data or automate tasks without needing complex setups.","Supports both local and cloud AI models|No setup required for immediate use|Integrates with major enterprise AI services","Limited information on security measures|No clear pricing structure provided|Potential complexity in managing local servers","OpenAI [openai.com]|Azure AI [azure.microsoft.com]|AWS AI [aws.amazon.com]","AI|desktop software|data integration|offline functionality","false","Information Technology","Desktop Software","true","true","2023","https://anythingllm.com/","https://docs.anythingllm.com/","https://github.com/Mintplex-Labs/anything-llm",,"/screenshots/anythingllm_com.png","/screenshots/anythingllm_com_640.png","/screenshots/anythingllm_com_400.png","2025-05-08T08:27:25.448Z"
"https://appflowy.com/","AppFlowy","appflowy.com","Unify projects, wikis, and teams with AI","AppFlowy is a versatile tool designed to integrate project management, wikis, and team collaboration, enhanced by AI capabilities. It serves as an all-in-one platform for teams looking to streamline their workflows and improve productivity. An example use case could be a software development team using AppFlowy to manage their project timelines, maintain documentation, and facilitate communication across departments.","Integrates multiple functions into one platform|AI-enhanced features for better productivity|User-friendly interface for easy adoption","May require initial learning curve|Potential over-reliance on AI for task management|Limited customization options compared to competitors","Notion [notion.so]|Confluence [atlassian.com/software/confluence]|Microsoft Teams [microsoft.com/en-us/microsoft-teams/group-chat-software]","project management|collaboration|AI|documentation","false","Project Management Office","Project Tools","true","true","2021","https://appflowy.com/","https://docs.appflowy.io/","https://github.com/AppFlowy-IO/appflowy","https://twitter.com/appflowy","/screenshots/appflowy_com.png","/screenshots/appflowy_com_640.png","/screenshots/appflowy_com_400.png","2025-05-09T03:15:34.530Z"
"https://bitspace.sh/","Bitspace","bitspace.sh","Creative computing for everyone","Bitspace is designed to foster creativity and innovation in computing. It serves as a platform where individuals from various backgrounds can explore and develop their creative ideas using technology. An example use case is a graphic designer using Bitspace to prototype interactive digital artworks, enhancing their creative workflow and productivity.","Encourages creative thinking|Supports diverse user backgrounds|Facilitates interactive digital creation","May require technical knowledge|Limited to creative computing|No clear pricing structure","Adobe Creative Cloud [adobe.com]|Sketch [sketch.com]|Figma [figma.com]","creative computing|digital art|innovation|technology","false","Creative","Design Tools","false","false","2021","https://bitspace.sh/",,"https://github.com/search?q=bitspace&type=repositories","https://twitter.com/newfrgmnt","/screenshots/bitspace_sh.png","/screenshots/bitspace_sh_640.png","/screenshots/bitspace_sh_400.png","2025-05-08T09:27:53.624Z"
"https://blue.cc","Blue","blue.cc","Manage projects effectively.","Blue is a comprehensive tool designed for managing various business processes and projects across industries. It supports teams in organizing and executing tasks efficiently, from sales and marketing to operations and recruitment. An example use case involves a marketing team using Blue to streamline campaign management and track performance metrics, enhancing collaboration and productivity.","Simple to use interface|Competitive pricing|Highly flexible and customizable","Potential learning curve for new users|May require integration with other tools|Limited support in some regions","Asana [asana.com]|Trello [trello.com]|Monday.com [monday.com]","project management|process management|productivity|collaboration","true","Project Management Office","Project Tools","true","false","2015","https://blue.cc","https://blue.cc/docs","https://github.com/search?q=blue&type=repositories",,"/screenshots/blue_cc.png","/screenshots/blue_cc_640.png","/screenshots/blue_cc_400.png","2025-05-08T08:54:11.138Z"
"https://buouui.com/","BuouUI","buouui.com","Make your website more awesome","BuouUI is a TailwindCSS UI library designed to enhance web development efficiency. It offers a wide range of components, sections, and templates that users can simply copy and paste into their projects. This tool is ideal for developers looking to quickly build and deploy attractive UIs without the hassle of designing from scratch. An example use case would be a developer needing to implement a responsive and modern UI for an e-commerce platform, where they can utilize BuouUI's e-commerce templates and components.","Wide range of ready-to-use components|Easy integration with copy-paste functionality|Regular updates and new components","Limited to TailwindCSS|May not suit all design requirements|Potential overuse leading to uniformity in designs","Tailwind UI [tailwindui.com]|Bootstrap [getbootstrap.com]|Material-UI [mui.com]","UI library|web development|TailwindCSS|component library","false","Design","Design Tools","true","true","2021","https://buouui.com/","https://buouui.com/documentation","https://github.com/buoooou","https://x.com/intent/follow?screen_name=buoooou0","/screenshots/buouui_com.png","/screenshots/buouui_com_640.png","/screenshots/buouui_com_400.png","2025-05-09T02:00:59.512Z"
"https://composio.dev/","Composio","composio.dev","Access 250+ Apps in One Code Line","Composio is a developer-first platform that simplifies the integration of AI agents and large language models (LLMs) with over 250 tools. It is designed for developers looking to build AI-driven applications without the hassle of managing multiple integrations. Example use case: A developer can use Composio to connect an AI agent to Salesforce, GitHub, and Slack, enabling automated workflows and data synchronization across these platforms.","Connect over 250 apps effortlessly|Built-in authentication management|24/7 support and security compliance","May be complex for beginners|Potentially high cost for enterprise scale|Limited customization in free tier","Zapier [zapier.com]|Integromat [integromat.com]|IFTTT [ifttt.com]","AI|integration|developer tools|automation","true","Development","APIs","true","true","2023","https://composio.dev/","https://composio.dev/docs","https://github.com/composiohq/composio/","https://x.com/paul1493/status/1821836341082022397","/screenshots/composio_dev.png","/screenshots/composio_dev_640.png","/screenshots/composio_dev_400.png","2025-05-09T10:28:03.496Z"
"https://copycoder.ai/","CopyCoder","copycoder.ai","Build apps faster with AI prompts","CopyCoder is designed for the new generation of AI coders, enabling them to transform images of applications, UI mockups, or custom designs into actionable coding prompts. Users can simply drag and drop images to start creating their applications more efficiently. This tool is ideal for developers looking to streamline their workflow and enhance productivity by leveraging AI capabilities in app development.","Streamlines app development|Supports image-based prompt generation|Enhances developer productivity","Limited to image inputs|May require technical understanding|Dependent on image quality","Retool [retool.com]|Bubble [bubble.io]|AppGyver [appgyver.com]","AI|app development|productivity|image processing","false","Development","Development","false","false","2025","https://copycoder.ai/",,"https://github.com/search?q=copycoder&type=repositories","https://x.com/CopyCoderAI","/screenshots/copycoder_ai.png","/screenshots/copycoder_ai_640.png","/screenshots/copycoder_ai_400.png","2025-05-08T11:22:17.580Z"
"https://depositphotos.com/","Depositphotos","depositphotos.com","Royalty-free stock media for projects","Depositphotos offers a vast library of 313 million royalty-free images, videos, vectors, illustrations, and music. It is designed for businesses and creative professionals who need high-quality visual and audio content for their projects. Users can explore thematic collections and utilize resources for various needs such as advertising, presentations, or web design.","Extensive media library|High-quality content|Trusted by leading companies","Subscription can be expensive|Limited free content|Complex licensing terms","Shutterstock [shutterstock.com]|Adobe Stock [stock.adobe.com]|Getty Images [gettyimages.com]","stock photos|royalty-free media|video library|music library","false","Marketing","Content Management","false","false","2009","https://depositphotos.com/",,"https://github.com/search?q=depositphotos&type=repositories",,"/screenshots/depositphotos_com.png","/screenshots/depositphotos_com_640.png","/screenshots/depositphotos_com_400.png","2025-05-08T10:28:39.885Z"
"https://divmagic.com/","DivMagic","divmagic.com","Copy any website design easily","DivMagic enables users to effortlessly extract HTML/CSS code from any element of a website with just one click. It is designed for web developers and designers who wish to speed up their workflow by reusing components from existing websites. For example, a user can copy a navigation bar from a website and convert it into a React component, simplifying the development process.","One-click code copying|Converts CSS to Tailwind CSS|Integration with development tools","Potential legal and ethical issues|Dependence on browser compatibility|Limited to web elements only","Webflow [webflow.com]|Pinegrow [pinegrow.com]|Figma [figma.com]","web scraping|design tools|web development|CSS conversion","false","Development","Design Tools","true","true","2021","https://divmagic.com/","https://divmagic.com/documentation","https://github.com/DivMagicCom/DivMagic","https://twitter.com/Mokkapps/status/1662745590692757504","/screenshots/divmagic_com.png","/screenshots/divmagic_com_640.png","/screenshots/divmagic_com_400.png","2025-05-08T13:34:52.009Z"
"https://electrobun.dev/","Electrobun","electrobun.dev","Ultra fast, tiny desktop apps","Electrobun is designed for developers seeking to build, update, and distribute cross-platform desktop applications efficiently. Utilizing Typescript for both main and webview processes, it simplifies development by removing language barriers and focusing on performance. With Electrobun, you can start coding within minutes and distribute updates that are as small as 4KB, significantly reducing bandwidth costs. Ideal for developers aiming to create lightweight applications with frequent updates.","Unified language for all processes|Fast and small application updates|Integrated workflow for quick start","Limited to Typescript developers|May require familiarity with bun and zig|Focused only on desktop applications","Electron [electronjs.org]|NW.js [nwjs.io]|Tauri [tauri.studio]","desktop software|typescript|application development|cross-platform","false","Development","Desktop Software","false","true","2023","https://electrobun.dev/","https://electrobun.dev/docs","https://github.com/blackboardsh/electrobun","https://x.com/BlackboardTech","/screenshots/electrobun_dev.png","/screenshots/electrobun_dev_640.png","/screenshots/electrobun_dev_400.png","2025-05-08T11:21:46.171Z"
"https://enginemailer.com","Enginemailer","enginemailer.com","Free Email Marketing Software","Enginemailer is an email marketing platform designed for freelancers, SMEs, and enterprises. It allows users to manage contacts, create campaigns, and monitor results effectively. Users can start with up to 10,000 free emails monthly, making it ideal for businesses looking to grow their audience without initial investment.","Free tier available with generous limits|Comprehensive dashboard for campaign tracking|Integration capabilities with APIs","Potentially steep learning curve for new users|Limited customization in free templates|May require technical knowledge for advanced features","Mailchimp [mailchimp.com]|Sendinblue [sendinblue.com]|Constant Contact [constantcontact.com]","email marketing|campaign management|lead generation|analytics","true","Marketing","Email Tools","true","false","2018","https://enginemailer.com","https://enginemailer.com/support","https://github.com/search?q=enginemailer&type=repositories",,"/screenshots/enginemailer_com.png","/screenshots/enginemailer_com_640.png","/screenshots/enginemailer_com_400.png","2025-05-07T11:49:30.908Z"
"https://evidence.dev","Evidence","evidence.dev","Business Intelligence as Code","Evidence is an open-source framework designed for building data-driven applications using SQL. It caters to data professionals and developers, enabling them to create polished data products quickly. An example use case is a company like Lenstra, which uses Evidence to handle all its reporting, showcasing its effectiveness in real-world data management and visualization.","Open source and free to start|Supports rapid deployment and maintenance|High-quality documentation and community support","May require SQL knowledge|Limited to data applications|Dependent on external data sources","Tableau [tableau.com]|Looker [looker.com]|Power BI [powerbi.microsoft.com]","business intelligence|data visualization|open source|SQL","false","Data & Analytics","Analytics","true","true","2021","https://evidence.dev","https://evidence.dev/docs","https://github.com/evidence-dev/evidence","https://twitter.com/evidence_dev","/screenshots/evidence_dev.png","/screenshots/evidence_dev_640.png","/screenshots/evidence_dev_400.png","2025-05-08T08:53:11.147Z"
"https://fliki.ai/","Fliki","fliki.ai","Turn text into videos with AI","Fliki is a tool designed to transform text into engaging videos using AI-powered voiceovers and video clips. It caters to businesses of all sizes, educators, and professionals who need quick video content without the hassle of traditional production methods. Users can create professional videos for marketing, training, or educational purposes in just minutes.","Easy to use with a simple editor|No need for voiceover artists|Supports multiple use cases","Dependent on AI quality|Limited customization options|Potential privacy concerns with AI usage","Lumen5 [lumen5.com]|InVideo [invideo.io]|Animoto [animoto.com]","AI|video creation|content generation|multimedia","false","Marketing","Content Management","true","false","2021","https://fliki.ai/",,"https://github.com/search?q=fliki&type=repositories","https://twitter.com/fliki_ai","/screenshots/fliki_ai.png","/screenshots/fliki_ai_640.png","/screenshots/fliki_ai_400.png","2025-05-08T10:29:02.123Z"
"https://floatui.com/","Float UI","floatui.com","Ship fast with Tailwind UI components","Float UI provides a comprehensive suite of free and open-source Tailwind CSS UI components and templates designed to help developers build responsive and modern websites quickly. Ideal for developers of all skill levels, Float UI simplifies the web development process by allowing easy integration with popular JavaScript frameworks. Example use case: A startup can use Float UI's templates to rapidly deploy a professional-looking e-commerce site.","Free and open-source|Supports multiple JS frameworks|Professionally designed templates","Limited customization options|No dedicated support|May require familiarity with Tailwind CSS","Tailwind Starter Kit [creative-tim.com]|DaisyUI [daisyui.com]|TUK [tuk.dev]","web development|UI components|open source|Tailwind CSS","false","Development","Design Tools","true","true","2020","https://floatui.com/",,"https://github.com/MarsX-dev/floatui","https://twitter.com/float_ui?s=09","/screenshots/floatui_com.png","/screenshots/floatui_com_640.png","/screenshots/floatui_com_400.png","2025-05-09T10:24:22.862Z"
"https://flyonui.com/","FlyonUI","flyonui.com","Free Tailwind CSS Components","FlyonUI is a comprehensive library of free Tailwind CSS components designed to simplify web development. It offers a wide range of ready-to-use components and templates, making it ideal for developers looking to speed up their workflow. Example use case includes building responsive and visually appealing web interfaces quickly without starting from scratch.","Wide range of components|Fully compatible with Tailwind CSS|Open-source and free forever","Limited to Tailwind CSS|No premium version for advanced features|May require customization for unique designs","Tailwind UI [tailwindui.com]|DaisyUI [daisyui.com]|Headless UI [headlessui.dev]","web development|CSS library|open source|component library","false","Development","Design Tools","true","true","2020","https://flyonui.com/","https://flyonui.com/docs","https://github.com/themeselection/flyonui","https://x.com/flyonui","/screenshots/flyonui_com.png","/screenshots/flyonui_com_640.png","/screenshots/flyonui_com_400.png","2025-05-08T08:33:44.773Z"
"https://frontly.ai/","Frontly","frontly.ai","Build custom apps with no code","Frontly enables users to create custom applications using AI without any coding expertise. It is designed for entrepreneurs, small businesses, and non-technical users who need to quickly deploy functional apps. Example use case includes a small business owner building a custom CRM system to manage customer interactions without needing to hire a developer.","No coding required|AI-powered features|Quick app deployment","Limited customization compared to coded apps|May not handle complex functionalities|Dependent on platform updates","Bubble [bubble.io]|Adalo [adalo.com]|AppGyver [appgyver.com]","no-code|app development|AI|SaaS","false","Product Management","Visual Builder","true","false","2021","https://frontly.ai/","https://frontly.ai/docs","https://github.com/search?q=frontly&type=repositories",,"/screenshots/frontly_ai.png","/screenshots/frontly_ai_640.png","/screenshots/frontly_ai_400.png","2025-05-08T08:26:35.412Z"
"https://gadget.dev/","Gadget","gadget.dev","Faster full-stack app development","Gadget simplifies the development of full-stack web applications by providing a suite of integrated tools that handle backend, frontend, and database management. It is designed for developers aiming to increase productivity and reduce time-to-market. Example use case: A developer can use Gadget to quickly build and deploy an e-commerce application, integrating custom APIs and managing data with ease.","Rapid development with no SQL or schema migrations|Built-in support for serverless API and real-time updates|Fully hosted with automatic scaling and maintenance","Limited customization compared to traditional stacks|Dependence on a single provider for all components|Potential for higher costs at scale","Firebase [firebase.google.com]|Heroku [heroku.com]|AWS Amplify [aws.amazon.com/amplify]","full-stack development|web apps|serverless|database management","true","Development","Backend Services","true","true","2021","https://gadget.dev/","https://docs.gadget.dev/","https://github.com/gadget-inc","https://x.com/gadget_dev","/screenshots/gadget_dev.png","/screenshots/gadget_dev_640.png","/screenshots/gadget_dev_400.png","2025-05-09T10:24:55.054Z"
"https://getcount.com/","COUNT","getcount.com","Accounting software for businesses","COUNT is a modern accounting software designed for ambitious businesses aiming to streamline their accounting processes. It integrates client management, project tracking, and secure communication, all in one platform. Ideal for firms looking to automate tasks like invoicing and document storage, COUNT enhances efficiency without the need for additional staff.","Automates repetitive accounting tasks|Secure client document storage|One-click data migration and real-time updates","Limited customization options|Potentially overwhelming features for small firms|Dependency on internet connectivity","QuickBooks [quickbooks.intuit.com]|Xero [xero.com]|FreshBooks [freshbooks.com]","accounting|automation|software as a service|data security","false","Finance & Accounting","Finance","true","false","2021","https://getcount.com/","https://getcount.com/docs","https://github.com/search?q=count&type=repositories","https://x.com/getcount","/screenshots/getcount_com.png","/screenshots/getcount_com_640.png","/screenshots/getcount_com_400.png","2025-05-09T02:00:45.653Z"
