sourceUrl,name,title,payoff,shortDescription,pros,cons,alternatives,tags,apiUsed,department,function,freeTier,openSource,releasedYear,websiteUrl,documentationUrl,githubUrl,twitterUrl,screenshot,screenshot_640,screenshot_400,updatedAt
"https://shopify.com","Shopify","shopify.com","Be the next big thing","Shopify is a leading e-commerce platform designed to help businesses of all sizes sell online and in person. It provides tools for store creation, payment processing, and multi-channel sales. An example use case is a small business owner using Shopify to set up an online store to sell handmade goods, leveraging Shopify's marketing tools to reach a wider audience and manage sales efficiently.","Comprehensive e-commerce features|Scalable for any business size|Strong multi-channel selling capabilities","Can be costly with add-ons and transaction fees|Steep learning curve for new users|Limited customization without coding","BigCommerce [bigcommerce.com]|WooCommerce [woocommerce.com]|Magento [magento.com]|Wix [wix.com]","e-commerce|online selling|multi-channel retail|store builder","true","Sales","E-commerce","true","false","2006","https://shopify.com","https://shopify.dev/docs","https://github.com/search?q=shopify&type=repositories","https://twitter.com/shopify","/screenshots/shopify_com.png","/screenshots/shopify_com_640.png","/screenshots/shopify_com_400.png","2025-05-08T11:22:11.321Z"
"https://soloist.ai/","Solo","soloist.ai","Launch your business with a free website","Solo is an AI-powered website creator designed for entrepreneurs and small businesses looking to establish an online presence quickly and without cost. Users can launch a fully functional website using AI-driven templates and customization tools. Ideal for startups, Solo helps in creating a professional-looking site for showcasing products, services, or portfolios.","Free to use|AI-driven design suggestions|Quick setup and launch","Limited customization options|May not scale well for larger businesses|Lacks advanced marketing tools","Wix [wix.com]|Squarespace [squarespace.com]|Weebly [weebly.com]","AI|website builder|entrepreneurship|startups","false","Marketing","Site Builder","true","false","2021","https://soloist.ai/",,"https://github.com/search?q=solo&type=repositories",,"/screenshots/soloist_ai.png","/screenshots/soloist_ai_640.png","/screenshots/soloist_ai_400.png","2025-05-08T09:27:06.032Z"
"https://stack-auth.com/","Stack Auth","stack-auth.com","Do auth in minutes.","Stack Auth is an open-source suite of tools designed for seamless authentication and user management. It is ideal for developers and businesses looking to integrate authentication solutions quickly and efficiently. Users can manage B2B customers with organizational and team support, access third-party OAuth APIs, and utilize beautifully styled components for rapid deployment. An example use case is a tech startup integrating Stack Auth to handle all user authentication processes, enhancing security and user experience without extensive development.","Open-source flexibility|Rapid integration capabilities|Extensive OAuth and JWT support","Requires technical knowledge to implement|Potentially limited support compared to paid solutions|Dependent on community contributions for updates","Auth0 [auth0.com]|Okta [okta.com]|Firebase Authentication [firebase.google.com]","authentication|open source|user management|OAuth","true","Information Technology","Authentication","true","true","2021","https://stack-auth.com/","https://stack-auth.com/docs","https://github.com/stack-auth/stack-auth",,"/screenshots/stack_auth_com.png","/screenshots/stack_auth_com_640.png","/screenshots/stack_auth_com_400.png","2025-05-08T10:27:57.245Z"
"https://surfsite.ai/","Surfsite","surfsite.ai","Enhance your web experience","Surfsite is a cutting-edge tool designed to optimize web interactions for businesses and individual users alike. It offers features like real-time analytics, user behavior tracking, and customized content delivery. Ideal for marketers and web developers, Surfsite can be used to increase user engagement and conversion rates through tailored web experiences.","Real-time user behavior tracking|Customizable content features|Robust analytics dashboard","Requires technical setup|May be costly for small businesses|Limited third-party integrations","Google Analytics [analytics.google.com]|Mixpanel [mixpanel.com]|Hotjar [hotjar.com]","web analytics|user engagement|behavior tracking|content customization","true","Marketing","Site Analytics","true","false","2021","https://surfsite.ai/","https://surfsite.ai/docs","https://github.com/search?q=surfsite&type=repositories","https://x.com/SurfsiteAI","/screenshots/surfsite_ai.png","/screenshots/surfsite_ai_640.png","/screenshots/surfsite_ai_400.png","2025-05-08T08:52:03.101Z"
"https://tablesprint.com/","TableSprint","tablesprint.com","Build Future-Ready apps fast","TableSprint is an AI-powered platform designed to help enterprises quickly develop and deploy custom applications. With a focus on no-code solutions, it allows users to integrate with existing systems like ERPs and CRMs, enhancing operational efficiency. Ideal for businesses looking to streamline processes without extensive coding, it's particularly useful for tasks like employee onboarding or complex workflow automation.","Rapid app development with no-code|Seamless integration with existing systems|AI-assisted design and workflow automation","May not suit highly specialized coding needs|Dependent on third-party integrations|Limited control over proprietary algorithms","Airtable [airtable.com]|Microsoft Power Apps [powerapps.microsoft.com]|Zoho Creator [zoho.com/creator]","no-code|AI|app development|enterprise software","true","Information Technology","Code-Free","false","false","2021","https://tablesprint.com/","https://tablesprint.com/api-docs","https://github.com/search?q=tablesprint&type=repositories","https://x.com/tablesprint","/screenshots/tablesprint_com.png","/screenshots/tablesprint_com_640.png","/screenshots/tablesprint_com_400.png","2025-05-09T10:25:06.271Z"
"https://typebot.io","Typebot","typebot.io","Build smarter, deploy seamlessly","Typebot is a no-code platform that simplifies the creation and integration of chatbots across various platforms like websites and WhatsApp. It's designed for businesses looking to enhance customer interactions through advanced chat experiences. Users can build bots with features like text, images, videos, and various input options, and integrate with services like OpenAI and Google Sheets. An ideal tool for marketing, sales, and support to engage users and convert leads.","Multichannel deployment options|Powerful integration capabilities|Extensive customization with no code","May require learning for non-technical users|Dependent on third-party integrations|Limited by the capabilities of no-code","ManyChat [manychat.com]|Chatfuel [chatfuel.com]|MobileMonkey [mobilemonkey.com]","chatbots|no-code|customer engagement|multichannel","true","Marketing","Chat & Calls","true","true","2019","https://typebot.io","https://typebot.io/docs","https://github.com/baptisteArno/typebot.io",,"/screenshots/typebot_io.png","/screenshots/typebot_io_640.png","/screenshots/typebot_io_400.png","2025-05-08T09:07:26.928Z"
"https://voideditor.com/","Void","voideditor.com","The open source AI code editor.","Void is an open-source AI-powered code editor designed for developers who want to enhance their coding efficiency and accuracy. It integrates various AI features such as Quick Edit, Chat, and Agent Mode, making it suitable for any software development environment. An example use case would be a developer using Void to quickly refactor code and integrate AI suggestions directly within their IDE.","AI-enhanced coding features|Integration with VS Code|Supports any LLM","Limited community support|May require familiarity with VS Code|Dependent on external LLMs for full functionality","Atom [atom.io]|Sublime Text [sublimetext.com]|Visual Studio Code [code.visualstudio.com]","AI|open source|code editor|software development","false","Development","Development","false","true","2025","https://voideditor.com/",,"https://github.com/voideditor/void#readme",,"/screenshots/voideditor_com.png","/screenshots/voideditor_com_640.png","/screenshots/voideditor_com_400.png","2025-05-08T11:22:51.812Z"